{
  "version": "1.0",
  "type": "adapter.register",
  "id": "register-1",
  "correlation_id": null,
  "payload": {
    "adapter_id": "qq",
    "instance_id": "main",
    "display_name": "QQ / NapCat",
    "config_schema": {"type": "object"},
    "config_summary": {"session_count": 1},
    "capabilities": [{"name": "user.get", "input_schema": {}, "output_schema": {}}],
    "extensions": [{"namespace": "qq", "name": "poke", "directions": ["input", "output"], "parameters_schema": {"type": "object"}}],
    "skills": []
  }
}
